feature;eng;dk;se;no;fi;nl;de;fr
waterproof;Water and sweat-resistant. Light and easy to dry.;Modstandsdygtig overfor vand og sved. Let og let at tørre.;Vatten- och svett tålig. Lätt och torkar snabbt.;;;;;
waterproof;Waterproof and breathable.;Vandtæt og åndbart.;Vattentät och andningsbar. ;;;;;
waterproof;Water-resistant and quick-drying ;Vandafvisende og hurtigtørrende;Vattentålig och snabbtorkande.;;;;;
durable;Extra durable against daily wear-and-tear.;Ekstra holdbart imod daglig slid.;Extra tålig mot dagligt slitage. ;;;;;
durable;Tough and long-term durable. ;Hård og holdbar.;Stark och långsiktigt hållbar;;;;;
durable;High-quality durability. ;Holdbarhed af høj kvalitet.;Högkvalitativ hållbarhet;;;;;
Steel buckle;Features a robust and reliable steel buckle.;Har en robust og pålidelig stålspænde.;;;;;;
Steel buckle;Includes a durable buckle made from high-quality steel. ;Inkluderer et holdbart spænde lavet af stål af høj kvalitet.;;;;;;
Rhinestone buckle;Features a elegant and sparkly rhinestone buckle.;Har en elegant og glitrende rhinsten spænde.;;;;;;
Rhinestone buckle;Includes a durable buckle covered in timeless rhinestones. ;Inkluderer en holdbar spænde dækket af tidløse rhinsten.;;;;;;
