eng;dk;se;no;fi;nl;de;fr
Watch strap for [DEVICE NAME]. A perfect, flawless fit. Easy and quick to install. Easily adjustable size, easy to wear and take off.;Urrem til [DEVICE NAME]. Perfekt pasform. Giver fuld beskyttelse af dit [DEVICE NAME] imod ridser, fald og stød. Let og hurtig at påsætte. Nemt at justere i størrelsen, nemt at tage på og af.;Klockarmband till [DEVICE NAME]. En perfekt, fulländad passform. Enkel och snabb att fästa. Enkel storlek att anpassa, montera och ta av. ;;;;;
[COLOR] watch strap for [DEVICE NAME]. Lets you make your smartwatch look even better. An ideal watch strap replacement for your old or broken one.;[COLOR] urrem til [DEVICE NAME]. Perfekt pasform. Giver fuld beskyttelse af dit [DEVICE NAME] imod ridser, fald og stød. Let og hurtig at påsætte. En ideel erstatningsrem til din gamle, ødelagte rem.;[COLOR] klockarmband till [DEVICE NAME]. Tillåter dig att göra din smartwatch ännu snyggare. En perfekt ersättning för ditt gamla eller trasiga armband. ;;;;;
[MATERIAL] watch strap for [DEVICE NAME]. Give your smartwatch a little extra flair and style. Fits your [DEVICE NAME] perfectly and sits comfortably on your wrist.;[MATERIAL] urrem til [DEVICE NAME]. Perfekt pasform. Giver fuld beskyttelse af dit [DEVICE NAME] imod ridser, fald og stød. Let og hurtig at påsætte. En perfekt erstatningsrem for din gamle [DEVICE NAME] rem.;[MATERIAL] klockarmband till [DEVICE NAME]. Ger din smartwatch lite extra elegans och stil. Passar din [DEVICE NAME] perfekt, och sitter bekvämt på handleden. ;;;;;
[MATERIAL] watch strap for [DEVICE NAME] in [COLOR]. A perfect, flawless fit. Keeps your [DEVICE NAME] securely on your wrist, while you have access to all its features. Personalize your smartwatch with this exquisite strap to make it more attractive and unique.;[MATERIAL] urrem til [DEVICE NAME] i [COLOR]. Perfekt pasform. Giver fuld beskyttelse af dit [DEVICE NAME] imod ridser, fald og stød. Let og hurtig at påsætte. Personliggør dit smartwatch med denne flotte rem og gør det mere attraktivt og unikt.;[MATERIAL] klockarmband till [DEVICE NAME] i [COLOR]. En perfekt, fulländad passform. Håller din [DEVICE NAME] säkert på din handled, medan du har tillgång till alla dess verktyg. Gör din smartwatch lika unik som du med detta snygga och slitstarka klockarmband.;;;;;
[COLOR] watch strap for [DEVICE NAME] in [MATERIAL]. A perfect, flawless fit. Easy and quick to install. Suitable for any occasion.;[COLOR] urrem til [DEVICE NAME] i [MATERIAL]. Perfekt pasform. Giver fuld beskyttelse af dit [DEVICE NAME] imod ridser, fald og stød. Let og hurtig at påsætte.;[COLOR] klockarmband till [DEVICE NAME] i [MATERIAL] med perfekt, fulländad passform. Snabb och enkel att montera. Passar alla tillfällen.;;;;;
[COLOR] [MATERIAL] watch strap for [DEVICE NAME]. A perfect, flawless fit. Soft, light and comfortable to wear.;[COLOR] [MATERIAL] urrem til [DEVICE NAME]. Perfekt pasform. Giver fuld beskyttelse af dit [DEVICE NAME] imod ridser, fald og stød. Let og hurtig at påsætte.;[COLOR] [MATERIAL] klockarmband till [DEVICE NAME]. En perfekt och fulländad. Mjuk, lätt och bekvämt att ha på sig.;;;;;
[DEVICE NAME] watch strap which gives you seamless access and full control of your smartwatch. A perfect, flawless fit that always protects your watch. A perfect alternative to your old wristband, or replacement for your broken one.;;[DEVICE NAME] klockarmband som ger dig obehindrad tillgång och total kontroll över din smartwatch. Perfekt, fulländad passform som alltid håller din klocka på säker plats. Ett perfekt alternativ för ditt gamla armband, eller ersättning för ditt trasiga.;;;;;
Unique [DEVICE NAME] watch strap in [MATERIAL]. Secures your smartwatch to your wrist while allowing seamless access to its functions. A stylish and durable alternative to your old or broken watch strap. ;;Unikt [DEVICE NAME] klockarmband i [MATERIAL]. Håller din smartwatch säkert på handleden samtidigt som den ger dig tillgång obehindrad tillgång till dess verktyg. Ett stilrent och slitstarkt alternativ till ditt gamla eller trasiga klockarmband.;;;;;
Stylish watch band in durable [MATERIAL] for [DEVICE NAME]. A comfortably fitting and easily adjustable strap in timeless [COLOR]. ;;Stilrent klockarmband i slitstarkt [MATERIAL] till [DEVICE NAME]. Ett bekvämt och anpassningsbart armband i tidlös [COLOR].;;;;;
[MATERIAL] watch strap for [DEVICE NAME] in [COLOR]. A comfortable watch strap that makes your smartwatch as stylish as it is practical. ;;[MATERIAL] klockarmband till [DEVICE NAME] i [COLOR]. Ett bekvämt klockarmband som gör din smartwatch lika stilren som den är praktisk.;;;;;
Comfortable and secure [DEVICE NAME] watch strap in [MATERIAL]. Easy to adjust in size, easy to attach and take off. A stylish replacement for your old wristband.;;Bekvämt och tryggt [DEVICE NAME] klockarmband i [MATERIAL]. Enkel att justera, montera och ta av. En stilren ersättning till ditt gamla klockarmband.;;;;;
[COLOR] watch strap in [MATERIAL] for [DEVICE NAME]. A modern and stylish replacement for your old or broken watch strap. Easily adjustable and secure. A perfect fit for all occasions.;;[COLOR] klockarmband i [MATERIAL] till [DEVICE NAME]. En modern och stilren ersättning för ditt gamla eller trasiga klockarmband. Tryggt och enkelt att justera. Passar alla tillfällen.;;;;;
Modern and comfortable [DEVICE NAME] watch strap in [COLOR]. Made from durable [MATERIAL] to ensure a perfect, and secure fit. This stylish wristband is perfect for all occasions, and a great replacement for your old or broken one.;;Modernt och bekvämt [DEVICE NAME] klockarmband i [COLOR]. Tillverkat av slitstarkt [MATERIAL] för att garantera perfekt, och trygg passform. Denna stilrena armband passar perfekt till alla tillfällen, och är en utmärkt ersättning för ditt gamla eller trasiga armband.;;;;;
[COLOR] [DEVICE NAME] watch strap in durable and comfortable [MATERIAL]. A perfect replacement for your old or broken watch strap that is as stylish and unique as you. ;;[COLOR] [DEVICE NAME] klockarmband i slitstarkt och bekvämt [MATERIAL]. En perfekt ersättning för ditt trasiga eller gamla klockarmband, som dessutom är lika unikt som du.;;;;;
Trendy [DEVICE NAME] watch strap in comfortable [MATERIAL]. As secure and reliable as it is stylish. Easy to adjust and attach, as well as take off. The replacement watch strap for your old or broken one that you have been looking for.;;Trendigt [DEVICE NAME] klockarmband i bekvämt [MATERIAL]. Lika pålitligt och bekvämt som det är stilrent. Enkelt att justera, montera och ta av. Den perfekt ersättningen till ditt gamla eller trasiga klockarmband som du letat efter!;;;;;
[DEVICE NAME] replacement watch strap in beautiful and reliable [COLOR] [MATERIAL]. Allows your smartwatch to sit comfortably and securely on your wrist, while giving you seamless access to its functions.;;[DEVICE NAME] ersättnings klockarmband i vacker och pålitlig [COLOR] [MATERIAL]. Tillåter din smartklocka att sitta bekvämt och tryggt på din handled, medan du har obehindrad tillgång till dess funktioner.;;;;;
Watch strap in [COLOR] [MATERIAL] for [DEVICE NAME]. A flawless, comfortable fit that is easy to adjust, attach and take off. A stylish and durable replacement for your old wristband. Perfect for all occasions.;;Klockarmband i [COLOR] [MATERIAL] till [DEVICE NAME]. Med fulländad passform sitter den bekvämt på din handled, och är enkel att justera, montera samt ta av. En stilren och slitstark ersättning till ditt gamla armband. Perfekt för alla tillfällen.;;;;;
[DEVICE NAME] watch strap in both stylish and reliable [COLOR] [MATERIAL]. Keep your smartwatch securely and comfortably on your wrist while you go about your day. The perfect replacement for your old or broken watch strap!;;[DEVICE NAME] klockarmband i både stilren och pålitlig [COLOR] [MATERIAL]. Håller din smartwatch bekvämt och tryggt på din handled medan du tar itu med vardagen. Den perfekta ersättningen för ditt gamla eller trasiga klockarmband!;;;;;
Trendy [DEVICE NAME] watch strap in comfortable [MATERIAL]. As secure and reliable as it is stylish. Easy to adjust and attach, as well as take off. The replacement watch strap for your old or broken one that you have been looking for.;;Trendigt [DEVICE NAME] klockarmband i bekvämt [MATERIAL]. Lika tryggt och pålitligt som det är stilrent och snyggt. Enkel att justera, montera och ta av. Ersättnings armbandet för ditt gamla eller trasiga som du har letat efter!;;;;;
